{
  "id": "chrome.cookie-pane",
  "semantic": {
    "id": "chrome.cookie-pane",
    "category": "CHROME"
  },
  "source": {
    "id": "CookiePane",
    "tag": "div",
    "file": "src/components/layout/CookiePane.jsx",
    "lines": "12-58"
  },
  "retrievalEligible": false,
  "retrievalEligibleReason": "First-visit cookie consent banner: a fixed utility notice that carries no page content and disappears once consent is stored, so it must never be retrieved as a composable page section.",
  "purpose": "First-visit cookie notice pinned bottom-right on a paper panel; Close stores consent for one day and fades it out.",
  "cite": [
    {
      "at": "src/components/layout/CookiePane.jsx:12-58",
      "quote": "export default function CookiePane()"
    },
    {
      "at": "src/components/layout/Layout.jsx:74",
      "quote": "<CookiePane />"
    }
  ],
  "usedInTemplates": [
    "template.home",
    "template.not-found"
  ],
  "constraints": {
    "onePerPage": true,
    "region": "chrome"
  },
  "content": {
    "fields": {
      "message": {
        "type": "string",
        "observedWords": 7,
        "maxWords": 9,
        "copyClass": "ui-microcopy",
        "observed": "We use cookies to make things better",
        "cite": [
          {
            "at": "src/data/site.js:12",
            "quote": "title: 'We use cookies to make things better'"
          }
        ]
      },
      "closeLabel": {
        "type": "string",
        "observedWords": 1,
        "maxWords": 2,
        "copyClass": "ui-microcopy",
        "observed": "Close",
        "cite": [
          {
            "at": "src/data/site.js:12",
            "quote": "close: 'Close'"
          }
        ]
      }
    }
  },
  "motion": {
    "pattern": "fade",
    "trigger": "on-mount-and-close",
    "reducedMotionFallback": "none-in-source",
    "cite": [
      {
        "at": "src/components/layout/CookiePane.jsx:25-29",
        "quote": "duration: 0.7, ease: 'circ.inOut'"
      }
    ],
    "details": {
      "close": "sets consent cookie for 1 day, fades out over 700ms, stays mounted with pointer-events none"
    }
  },
  "responsive": {
    "desktop": {
      "width": {
        "designPx": 430
      }
    },
    "tablet": {
      "width": {
        "designPx": 430
      }
    },
    "mobile": {
      "width": "100%"
    },
    "cite": [
      {
        "at": "src/components/layout/CookiePane.jsx:43",
        "quote": "mobile:w-full"
      }
    ]
  },
  "tokens": [
    "type.cookie-pane",
    "surface.inverse",
    "text.inverse",
    "text.cookie-link-rest",
    "layer.cookie-pane",
    "component.cookie-pane.box",
    "motion.duration.700"
  ],
  "composes": []
}
